{
  "published_at": "2026-10-15T17:51:21Z",
  "appended_today": true,
  "first_publish": "2026-07-08T15:57:29Z",
  "rows": [
    {
      "col_as_of": null,
      "col_yoy_pct": null,
      "coverage_pct": 40.5,
      "date": "2026-07-08",
      "dc_build_as_of": null,
      "dc_build_yoy_pct": null,
      "dc_hardware_as_of": null,
      "dc_hardware_yoy_pct": null,
      "dc_ops_as_of": null,
      "dc_ops_yoy_pct": null,
      "gauge_as_of": "2026-07-06",
      "gauge_yoy_pct": 2.3,
      "official_month": "2026-05-01",
      "official_yoy_pct": 4.25,
      "pce_as_of": null,
      "pce_yoy_pct": null,
      "published_at": "2026-07-08T15:57:29Z",
      "supercore_as_of": null,
      "supercore_yoy_pct": null,
      "tracker_as_of": "2026-07-06",
      "tracker_yoy_pct": 2.74
    },
    {
      "col_as_of": null,
      "col_yoy_pct": null,
      "coverage_pct": 0,
      "date": "2026-07-08",
      "dc_build_as_of": null,
      "dc_build_yoy_pct": null,
      "dc_hardware_as_of": null,
      "dc_hardware_yoy_pct": null,
      "dc_ops_as_of": null,
      "dc_ops_yoy_pct": null,
      "gauge_as_of": "2026-07-06",
      "gauge_yoy_pct": 3.38,
      "official_month": "2026-05-01",
      "official_yoy_pct": 4.25,
      "pce_as_of": null,
      "pce_yoy_pct": null,
      "published_at": "2026-07-08T20:02:11Z",
      "supercore_as_of": null,
      "supercore_yoy_pct": null,
      "tracker_as_of": "2026-07-06",
      "tracker_yoy_pct": 3.79
    },
    {
      "col_as_of": null,
      "col_yoy_pct": null,
      "coverage_pct": 40.5,
      "date": "2026-07-08",
      "dc_build_as_of": null,
      "dc_build_yoy_pct": null,
      "dc_hardware_as_of": null,
      "dc_hardware_yoy_pct": null,
      "dc_ops_as_of": null,
      "dc_ops_yoy_pct": null,
      "gauge_as_of": "2026-07-06",
      "gauge_yoy_pct": 3.38,
      "official_month": "2026-05-01",
      "official_yoy_pct": 4.25,
      "pce_as_of": null,
      "pce_yoy_pct": null,
      "published_at": "2026-07-08T20:05:55Z",
      "supercore_as_of": null,
      "supercore_yoy_pct": null,
      "tracker_as_of": "2026-07-06",
      "tracker_yoy_pct": 3.79
    },
    {
      "col_as_of": null,
      "col_yoy_pct": null,
      "coverage_pct": 40.5,
      "date": "2026-07-08",
      "dc_build_as_of": null,
      "dc_build_yoy_pct": null,
      "dc_hardware_as_of": null,
      "dc_hardware_yoy_pct": null,
      "dc_ops_as_of": null,
      "dc_ops_yoy_pct": null,
      "gauge_as_of": "2026-07-06",
      "gauge_yoy_pct": 3.38,
      "official_month": "2026-05-01",
      "official_yoy_pct": 4.25,
      "pce_as_of": null,
      "pce_yoy_pct": null,
      "published_at": "2026-07-08T20:46:15Z",
      "supercore_as_of": null,
      "supercore_yoy_pct": null,
      "tracker_as_of": "2026-07-06",
      "tracker_yoy_pct": 3.79
    },
    {
      "col_as_of": null,
      "col_yoy_pct": null,
      "coverage_pct": 40.5,
      "date": "2026-07-09",
      "dc_build_as_of": null,
      "dc_build_yoy_pct": null,
      "dc_hardware_as_of": null,
      "dc_hardware_yoy_pct": null,
      "dc_ops_as_of": null,
      "dc_ops_yoy_pct": null,
      "gauge_as_of": "2026-07-06",
      "gauge_yoy_pct": 3.38,
      "official_month": "2026-05-01",
      "official_yoy_pct": 4.25,
      "pce_as_of": null,
      "pce_yoy_pct": null,
      "published_at": "2026-07-09T19:31:49Z",
      "supercore_as_of": null,
      "supercore_yoy_pct": null,
      "tracker_as_of": "2026-07-06",
      "tracker_yoy_pct": 3.79
    },
    {
      "col_as_of": "2026-07-09",
      "col_yoy_pct": 3.08,
      "coverage_pct": 40.5,
      "date": "2026-07-10",
      "dc_build_as_of": null,
      "dc_build_yoy_pct": null,
      "dc_hardware_as_of": null,
      "dc_hardware_yoy_pct": null,
      "dc_ops_as_of": null,
      "dc_ops_yoy_pct": null,
      "gauge_as_of": "2026-07-09",
      "gauge_yoy_pct": 3.05,
      "official_month": "2026-05-01",
      "official_yoy_pct": 4.25,
      "pce_as_of": "2026-07-09",
      "pce_yoy_pct": 3.51,
      "published_at": "2026-07-10T02:33:34Z",
      "supercore_as_of": "2026-05-01",
      "supercore_yoy_pct": 3.48,
      "tracker_as_of": "2026-07-09",
      "tracker_yoy_pct": 3.83
    },
    {
      "col_as_of": "2026-07-10",
      "col_yoy_pct": 2.13,
      "coverage_pct": 40.5,
      "date": "2026-07-10",
      "dc_build_as_of": null,
      "dc_build_yoy_pct": null,
      "dc_hardware_as_of": null,
      "dc_hardware_yoy_pct": null,
      "dc_ops_as_of": null,
      "dc_ops_yoy_pct": null,
      "gauge_as_of": "2026-07-10",
      "gauge_yoy_pct": 2.24,
      "official_month": "2026-05-01",
      "official_yoy_pct": 4.25,
      "pce_as_of": "2026-07-10",
      "pce_yoy_pct": 2.92,
      "published_at": "2026-07-10T14:33:55Z",
      "supercore_as_of": "2026-05-01",
      "supercore_yoy_pct": 3.48,
      "tracker_as_of": "2026-07-10",
      "tracker_yoy_pct": 3.02
    },
    {
      "col_as_of": "2026-07-10",
      "col_yoy_pct": 2.13,
      "coverage_pct": 40.5,
      "date": "2026-07-10",
      "dc_build_as_of": null,
      "dc_build_yoy_pct": null,
      "dc_hardware_as_of": null,
      "dc_hardware_yoy_pct": null,
      "dc_ops_as_of": null,
      "dc_ops_yoy_pct": null,
      "gauge_as_of": "2026-07-10",
      "gauge_yoy_pct": 2.24,
      "official_month": "2026-05-01",
      "official_yoy_pct": 4.25,
      "pce_as_of": "2026-07-10",
      "pce_yoy_pct": 2.92,
      "published_at": "2026-07-10T14:45:29Z",
      "supercore_as_of": "2026-05-01",
      "supercore_yoy_pct": 3.48,
      "tracker_as_of": "2026-07-10",
      "tracker_yoy_pct": 3.02
    },
    {
      "col_as_of": "2026-07-10",
      "col_yoy_pct": 2.13,
      "coverage_pct": 40.5,
      "date": "2026-07-10",
      "dc_build_as_of": null,
      "dc_build_yoy_pct": null,
      "dc_hardware_as_of": null,
      "dc_hardware_yoy_pct": null,
      "dc_ops_as_of": null,
      "dc_ops_yoy_pct": null,
      "gauge_as_of": "2026-07-10",
      "gauge_yoy_pct": 2.24,
      "official_month": "2026-05-01",
      "official_yoy_pct": 4.25,
      "pce_as_of": "2026-07-10",
      "pce_yoy_pct": 2.92,
      "published_at": "2026-07-10T15:17:14Z",
      "supercore_as_of": "2026-05-01",
      "supercore_yoy_pct": 3.48,
      "tracker_as_of": "2026-07-10",
      "tracker_yoy_pct": 3.02
    },
    {
      "col_as_of": "2026-07-10",
      "col_yoy_pct": 2.1,
      "coverage_pct": 40.5,
      "date": "2026-07-10",
      "dc_build_as_of": null,
      "dc_build_yoy_pct": null,
      "dc_hardware_as_of": null,
      "dc_hardware_yoy_pct": null,
      "dc_ops_as_of": null,
      "dc_ops_yoy_pct": null,
      "gauge_as_of": "2026-07-10",
      "gauge_yoy_pct": 2.24,
      "official_month": "2026-05-01",
      "official_yoy_pct": 4.25,
      "pce_as_of": "2026-07-10",
      "pce_yoy_pct": 2.92,
      "published_at": "2026-07-10T18:05:47Z",
      "supercore_as_of": "2026-05-01",
      "supercore_yoy_pct": 3.48,
      "tracker_as_of": "2026-07-10",
      "tracker_yoy_pct": 3.02
    },
    {
      "col_as_of": "2026-07-10",
      "col_yoy_pct": 2.94,
      "coverage_pct": 40.5,
      "date": "2026-07-10",
      "dc_build_as_of": null,
      "dc_build_yoy_pct": null,
      "dc_hardware_as_of": null,
      "dc_hardware_yoy_pct": null,
      "dc_ops_as_of": null,
      "dc_ops_yoy_pct": null,
      "gauge_as_of": "2026-07-10",
      "gauge_yoy_pct": 3.07,
      "official_month": "2026-05-01",
      "official_yoy_pct": 4.25,
      "pce_as_of": "2026-07-10",
      "pce_yoy_pct": 3.53,
      "published_at": "2026-07-10T18:33:47Z",
      "supercore_as_of": "2026-05-01",
      "supercore_yoy_pct": 3.48,
      "tracker_as_of": "2026-07-10",
      "tracker_yoy_pct": 3.86
    },
    {
      "col_as_of": "2026-07-11",
      "col_yoy_pct": 2.94,
      "coverage_pct": 40.5,
      "date": "2026-07-11",
      "dc_build_as_of": null,
      "dc_build_yoy_pct": null,
      "dc_hardware_as_of": null,
      "dc_hardware_yoy_pct": null,
      "dc_ops_as_of": null,
      "dc_ops_yoy_pct": null,
      "gauge_as_of": "2026-07-11",
      "gauge_yoy_pct": 3.07,
      "official_month": "2026-05-01",
      "official_yoy_pct": 4.25,
      "pce_as_of": "2026-07-11",
      "pce_yoy_pct": 3.53,
      "published_at": "2026-07-11T23:34:37Z",
      "supercore_as_of": "2026-05-01",
      "supercore_yoy_pct": 3.48,
      "tracker_as_of": "2026-07-11",
      "tracker_yoy_pct": 3.86
    },
    {
      "col_as_of": "2026-07-12",
      "col_yoy_pct": 2.93,
      "coverage_pct": 40.5,
      "date": "2026-07-12",
      "dc_build_as_of": null,
      "dc_build_yoy_pct": null,
      "dc_hardware_as_of": null,
      "dc_hardware_yoy_pct": null,
      "dc_ops_as_of": null,
      "dc_ops_yoy_pct": null,
      "gauge_as_of": "2026-07-12",
      "gauge_yoy_pct": 3.07,
      "official_month": "2026-05-01",
      "official_yoy_pct": 4.25,
      "pce_as_of": "2026-07-12",
      "pce_yoy_pct": 3.53,
      "published_at": "2026-07-12T19:15:21Z",
      "supercore_as_of": "2026-05-01",
      "supercore_yoy_pct": 3.48,
      "tracker_as_of": "2026-07-12",
      "tracker_yoy_pct": 3.85
    },
    {
      "col_as_of": "2026-07-12",
      "col_yoy_pct": 2.93,
      "coverage_pct": 40.5,
      "date": "2026-07-12",
      "dc_build_as_of": "2026-07-10",
      "dc_build_yoy_pct": 6.58,
      "dc_hardware_as_of": null,
      "dc_hardware_yoy_pct": null,
      "dc_ops_as_of": "2026-06-01",
      "dc_ops_yoy_pct": 6.26,
      "gauge_as_of": "2026-07-12",
      "gauge_yoy_pct": 3.07,
      "official_month": "2026-05-01",
      "official_yoy_pct": 4.25,
      "pce_as_of": "2026-07-12",
      "pce_yoy_pct": 3.53,
      "published_at": "2026-07-12T20:52:08Z",
      "supercore_as_of": "2026-05-01",
      "supercore_yoy_pct": 3.48,
      "tracker_as_of": "2026-07-12",
      "tracker_yoy_pct": 3.85
    },
    {
      "col_as_of": "2026-07-12",
      "col_yoy_pct": 2.93,
      "coverage_pct": 40.5,
      "date": "2026-07-12",
      "dc_build_as_of": "2026-07-10",
      "dc_build_yoy_pct": 6.58,
      "dc_hardware_as_of": null,